{
  "$schema": "http://json-schema.org/draft-07/schema#",
  "$id": "https://github.com/Hen-Heang/ax-engineering-harness/schemas/adapter/v1",
  "title": "AdapterDefinition",
  "description": "AX Harness v1 vendor adapter. An adapter describes where a vendor tool reads its instructions and which shared documents that entrypoint defers to. An adapter is a surface, never a competing architecture, and holds no capabilities of its own.",
  "type": "object",
  "additionalProperties": false,
  "required": ["schemaVersion", "id", "vendor", "status", "entrypoint", "sharedInstructions", "notes"],
  "properties": {
    "schemaVersion": { "const": 1 },
    "id": { "$ref": "#/definitions/identifier" },
    "vendor": { "$ref": "#/definitions/line" },
    "status": { "enum": ["implemented", "experimental", "planned"] },
    "entrypoint": { "$ref": "#/definitions/repoPath", "description": "Repository-relative file the vendor tool loads first." },
    "sharedInstructions": {
      "type": "array",
      "minItems": 1,
      "maxItems": 16,
      "items": { "$ref": "#/definitions/repoPath" },
      "description": "Vendor-neutral documents this adapter surfaces to its tool. All must exist in the repository."
    },
    "notes": { "$ref": "#/definitions/notes" }
  },
  "definitions": {
    "identifier": { "type": "string", "pattern": "^[a-z][a-z0-9-]{0,63}$" },
    "line": { "type": "string", "minLength": 1, "maxLength": 96, "pattern": "^(?=.*\\S)[^\\u0000-\\u001f]+$" },
    "repoPath": {
      "type": "string",
      "minLength": 1,
      "maxLength": 512,
      "pattern": "^(?!/)(?!.*(?:^|/)\\.{1,2}(?:/|$))(?!.*[\\\\:\\u0000-\\u001f]).+\\.md$",
      "description": "Relative Markdown path using forward slashes. Absolute paths and parent traversal are forbidden."
    },
    "note": { "type": "string", "minLength": 1, "maxLength": 320, "pattern": "^(?=.*\\S)[^\\u0000-\\u001f]+$" },
    "notes": { "type": "array", "minItems": 1, "maxItems": 32, "items": { "$ref": "#/definitions/note" } }
  }
}
